crn,response,instructor
10685,i think a lot of students are not initially confident about their solutions and methods and reasoning so including a bank of solved question i feel would be one of the greatest resources for average students ifnot allotherwise there is no way his lectureclass could be more inclusive each lecture was a concentrated dose of pure insight,"Pavlu, Virgil"
10685,i strongly believe he is one of the best professor in khoury,"Pavlu, Virgil"
10685,at the beginning of the course and throughout each new concept the instructor would oftentimes use words designed to scare the students about the difficulty of the material in the course this turned meoff to some of the earlier lectures due to the fear tactic that he employed which was probably just to get people serious about the course and its difficulty however the students already knew the extent ofthe difficulty of the class and this only turned scared me enough to turn me off to learning,"Pavlu, Virgil"
30569,the professor used to be quite abstract at times about the concepts he was trying to explain this is subjective but having more visualizations would have really helped me score better there is a lot of selflearning involved which is good but also infeasible at times due to time constrains in general,"Tsekourakis, Iraklis"
30569,i think my instructor is good enough,"Tsekourakis, Iraklis"
30569,sometimes his penmanship is hard to read,"Tsekourakis, Iraklis"
30569,strength explanation of complex problem statements very wellimprovements could go little slow,"Tsekourakis, Iraklis"
30569,all good,"Tsekourakis, Iraklis"
30569,great course,"Tsekourakis, Iraklis"
30569,he will ask us questions if we dont have any questions the questions guide us to think on different aspect of the algorithm,"Tsekourakis, Iraklis"
37414,i liked the professors dedication to delivering highquality lecture the professor demonstrated clear passion for the subjecti am grateful for the opportunity to learn from such a knowledgeable instructor,"Shesh, Amit"
37414,none,"Shesh, Amit"
37414,overall it is a very inclusive class there was just one thing when classes first started the professor said that we are not allowed to join the teams live lecture its just for recording purposes if we doeveryone in person can see who is not attending class it felt kind of intimidating if we were actually sick or needed to attend remotely then we would be judged,"Shesh, Amit"
37414,he knows how to throughly explain concepts,"Shesh, Amit"
37414,the instructor is very knowledgeable and explains the concepts in a detailed manner he is very supportive and provides a good feedback on any doubts or queries asked his office hours are very useful andalso encourages students to push their boundaries to think of better coding approaches,"Shesh, Amit"
37414,overall the professor was great his teaching style was amazing and was very helpful in office hours as well i do not have any particular areas of improvement to suggest,"Shesh, Amit"
37414,hes good no comment,"Shesh, Amit"
37414,as mentioned one of the best professors ever met in terms of teachingexplains all the issues and solutions in detailcan hardly see any points that needs to be improved,"Shesh, Amit"
37414,the professor teaches the course very well so nothing much to improve,"Shesh, Amit"
37414,the professor was always available for outoftheclass discussions and doubtsthe professor gave constructive feedback on the exam solutions and different ways to solve a problem,"Shesh, Amit"
37414,every wednesday there will be a homework due however instructor always make an requirement change on tuesday class then everyone have to change their current progress even they have alreadydone,"Shesh, Amit"
37414,he is very good just 1 suggestion  he should explain how to write test cases please,"Shesh, Amit"
37414,he can make student understand knowledge easier by his speech,"Shesh, Amit"
37414,while i appreciate the structure and content of this course i believe there is significant room for improvement in terms of embracing evolving educational standards and methodologies as industries andtechnologies develop it is crucial for academic curricula to reflect these changes to remain relevant and effectivei observed that the course predominantly reflects a singular perspective primarily influenced by the instructors specific viewpoint in a dynamic learning environment incorporating multiple perspectivesand adapting to contemporary practices are essential for fostering a more robust understanding of the subjecti would recommend updating the curriculum to include a broader range of ideologies and teaching methods this update could better prepare students for practical application in their future careers byaligning more closely with the latest industry standards and practices,"Shesh, Amit"
37414,the group projects were the most fun ive ever had in a cs coursein terms of inclusive learning i wouldnt change a thing,"Shesh, Amit"
37414,sometimes the requirements are not clear for assignments which could be improved on,"Shesh, Amit"
37414,professor shesh is great at providing feedback in lecture and online through piazza or teams,"Shesh, Amit"
37414,professor shesh is a great instructor he makes his lectures accessible engaging and proivdes opportunities to put them in practice with his homework there are still struggles in managing the teamworkcomponents of his assignments as well as making sure his assignment materials are up to date,"Shesh, Amit"
37414,na,"Shesh, Amit"
37414,provide more transparent fair and reasonable scoring system,"Shesh, Amit"
41152,profound knowledge in web development,"Penarrieta, Cristian"
41152,know where to start,"Penarrieta, Cristian"
41152,very easy to follow lectures and very well designed quizs and assignments,"Penarrieta, Cristian"
41152,the instructor is experienced and professional,"Penarrieta, Cristian"
41152,this is an online development course and according to me the professor has done an excellent job,"Penarrieta, Cristian"
41152,everything is ok,"Penarrieta, Cristian"
41152,nan,"Penarrieta, Cristian"
36915,occasional group discussions helped in the beginning,"Annunziato, Jose"
36915,prof annunziato delivers information very clearly and is able to respond to questions to clarify student misunderstandings,"Annunziato, Jose"
36915,na,"Annunziato, Jose"
36915,na,"Annunziato, Jose"
36915,the professor possesses strong communication skills and is consistently available to assist students his grasp of web development is thorough ensuring that he imparts knowledge effectively theassignments are meticulously structured facilitating not only learning but also the practical application of concepts in project development this thoughtful design of coursework allows students toprogressively build their skills and confidence in web development,"Annunziato, Jose"
36915,as i said the three hours of live coding dont facilitate inclusive learning also the instructor team should pay more attention to assignment preparation this professor has taught this class for manysemesters so errorfree and clear assignment instructions are the basic expectation there are six assignments this semester and every assignment has more than five errorstypos which is unacceptableand makes people feel the instructor didnt treat the class seriously,"Annunziato, Jose"
36915,na,"Annunziato, Jose"
36915,if the code on the homework actually works it makes learning the content easier instead of spending a lot of time debugging,"Annunziato, Jose"
36915,the professor values an inclass learning environment that benefits everyone by ensuring the classroom is quiet allowing all students to fully focus on the lecture rather than discussing the course materialduring class,"Annunziato, Jose"
36915,he is clear and passioante about his teachings,"Annunziato, Jose"
36915,the class definitely imo focuses on breadth over depth i understand why it is a priority to have students touch on all the important concepts however it felt like a constant race to catch up witheverything i never really felt like i had a solid understanding of any given topic and rather than having time to work through it had to forego that understanding to be able to keep up with the next topic,"Annunziato, Jose"
36915,na,"Annunziato, Jose"
36915,he usually explains some difficult and complex content in simple way that we can all understand,"Annunziato, Jose"
36915,na,"Annunziato, Jose"
35159,see above,"Annunziato, Jose"
35159,while the instructor was helpful and approachable he could improve inclusivity by being more available outside of class and diversifying communication channels,"Annunziato, Jose"
35159,i hope we can spend an additional one or two classes on how to use javascript as im having a hard time digesting the new technology,"Annunziato, Jose"
35159,the highlight is the way this course is organized the instructor has made efforts to design the course to help us learn the tech stack required by the companies for the present day it was a great course oneof the best i have taken at neu,"Annunziato, Jose"
35159,its about ta part i have met these things too many times ta cancel the office hour frequently they showed late and reschedule the office hour i know it maybe emergencies but it is too frequent foronline courses the essential part is office hours but it didnt work as i expect,"Annunziato, Jose"
35159,na,"Annunziato, Jose"
35159,na,"Annunziato, Jose"
35159,smaller class more communication and feedback rather than just providing a word document for assignment requirements less nitpicky assignment requirements smaller knowledge gaps betweenassignments,"Annunziato, Jose"
35159,please hire better and responsible tas the current tas are really bad and the professor given the amount of hard work he puts in deserves better tas,"Annunziato, Jose"
35159,coursework was great,"Annunziato, Jose"
21104,very inclusive in all aspects probably the professor that cares about inclusivity the most so far i have seen,"Guerra Gomez, John Alexis"
21104,he is very friendly but i kind of hope the assignments are not so infrequent but big we pretty much just have 4 massive projects and almost nothing else i hope we had more lightweight projects and lessheavy massive projects instead,"Guerra Gomez, John Alexis"
21104,everything is good,"Guerra Gomez, John Alexis"
21104,loved the attitude i liked coming to class,"Guerra Gomez, John Alexis"
21104,overall well appreciated him mentioning he was learning chinese,"Guerra Gomez, John Alexis"
21104,show more cases related to the web development,"Guerra Gomez, John Alexis"
21104,the professor use the lottry and tweet to encourage student to preview all the material before class to have better overview for the knowledge points,"Guerra Gomez, John Alexis"
21104,na,"Guerra Gomez, John Alexis"
21104,professor john is very supportive some improvements could be that some rubrics may not be very clear to understand when we have the project teamwork does not achieve the goal of learningsomething withing a partner,"Guerra Gomez, John Alexis"
21104,while class was helpful sometimes it felt like the projects had nothing to do with what we had covered so far connecting to mongo and implementing crud was taught after that project was due same withteaching passportexpecting implementation having a more conducive schedule would be helpful to helping with our understanding rather than expecting us to figure it out completely on our own iunderstand that struggling is helpful with teaching but i dont think its fair to expect students to learn how to implement for assignments when the topics were not even properly introduced yet,"Guerra Gomez, John Alexis"
21104,sometimes the class can be quite stressful for introverted individuals like myself,"Guerra Gomez, John Alexis"
20297,very inclusive in all aspects probably the professor that cares about inclusivity the most so far i have seen,"Guerra Gomez, John Alexis"
20297,he is very friendly but i kind of hope the assignments are not so infrequent but big we pretty much just have 4 massive projects and almost nothing else i hope we had more lightweight projects and lessheavy massive projects instead,"Guerra Gomez, John Alexis"
20297,everything is good,"Guerra Gomez, John Alexis"
20297,loved the attitude i liked coming to class,"Guerra Gomez, John Alexis"
20297,overall well appreciated him mentioning he was learning chinese,"Guerra Gomez, John Alexis"
20297,show more cases related to the web development,"Guerra Gomez, John Alexis"
20297,the professor use the lottry and tweet to encourage student to preview all the material before class to have better overview for the knowledge points,"Guerra Gomez, John Alexis"
20297,na,"Guerra Gomez, John Alexis"
20297,professor john is very supportive some improvements could be that some rubrics may not be very clear to understand when we have the project teamwork does not achieve the goal of learningsomething withing a partner,"Guerra Gomez, John Alexis"
20297,while class was helpful sometimes it felt like the projects had nothing to do with what we had covered so far connecting to mongo and implementing crud was taught after that project was due same withteaching passportexpecting implementation having a more conducive schedule would be helpful to helping with our understanding rather than expecting us to figure it out completely on our own iunderstand that struggling is helpful with teaching but i dont think its fair to expect students to learn how to implement for assignments when the topics were not even properly introduced yet,"Guerra Gomez, John Alexis"
20297,sometimes the class can be quite stressful for introverted individuals like myself,"Guerra Gomez, John Alexis"
39710,i like how the prof creates a environment of learning i still remember in the first lecture maam brought cards to teach us insertion sort being able to picture what was happening made it very easy for meto understand it i really enjoyed studying this course and would love to take more course under prof lama,"Hamandi, Lama"
39710,professor is very nice and knowledgeable if we could focus more on leetcode questions and let us discuss  solve those questions with what we learned that will be more helpful,"Hamandi, Lama"
39710,na,"Hamandi, Lama"
39710,include more content in lecture thats not in reading,"Hamandi, Lama"
39710,the weekly course plan is well designed,"Hamandi, Lama"
39710,good,"Hamandi, Lama"
39710,great,"Hamandi, Lama"
39710,na,"Hamandi, Lama"
40399,this class will be very difficult but only compared to other water classes but precisely because of the difficulty the teacher will give a lot of help the only thing you need to do is to keep up with the teacherand seize the time for everything because you will find that this can be a very shining moment in your lifei would give richard a thumbs up,"Hoshino, Richard"
40399,na,"Hoshino, Richard"
40399,cant think of any,"Hoshino, Richard"
40399,richard is knowledgeable passionate and approachable had all the great traits to help us succeed,"Hoshino, Richard"
39706,this professor is irreproachable in this area he is sure to move at a pace that all can follow and does his best to allow all students to participate he also allows for ample question time,"Saad, Nadim"
39706,it would be helpful if the instructor could slow down the pace when explaining the new concepts and use less handwriting on the whiteboard,"Saad, Nadim"
39706,overall he is a friendly and good professor he provides good examples on the whiteboard and is open to student questions if he could provide information in advance that would be helpful,"Saad, Nadim"
39706,na,"Saad, Nadim"
39706,he did a great job already,"Saad, Nadim"
20294,very inclusive in all aspects probably the professor that cares about inclusivity the most so far i have seen,"Guerra Gomez, John Alexis"
20294,he is very friendly but i kind of hope the assignments are not so infrequent but big we pretty much just have 4 massive projects and almost nothing else i hope we had more lightweight projects and lessheavy massive projects instead,"Guerra Gomez, John Alexis"
20294,everything is good,"Guerra Gomez, John Alexis"
20294,loved the attitude i liked coming to class,"Guerra Gomez, John Alexis"
20294,overall well appreciated him mentioning he was learning chinese,"Guerra Gomez, John Alexis"
20294,show more cases related to the web development,"Guerra Gomez, John Alexis"
20294,the professor use the lottry and tweet to encourage student to preview all the material before class to have better overview for the knowledge points,"Guerra Gomez, John Alexis"
20294,na,"Guerra Gomez, John Alexis"
20294,professor john is very supportive some improvements could be that some rubrics may not be very clear to understand when we have the project teamwork does not achieve the goal of learningsomething withing a partner,"Guerra Gomez, John Alexis"
20294,while class was helpful sometimes it felt like the projects had nothing to do with what we had covered so far connecting to mongo and implementing crud was taught after that project was due same withteaching passportexpecting implementation having a more conducive schedule would be helpful to helping with our understanding rather than expecting us to figure it out completely on our own iunderstand that struggling is helpful with teaching but i dont think its fair to expect students to learn how to implement for assignments when the topics were not even properly introduced yet,"Guerra Gomez, John Alexis"
20294,sometimes the class can be quite stressful for introverted individuals like myself,"Guerra Gomez, John Alexis"
20295,the passion for experiential learning is great but this is not experiential learning experiential learning needs more flexibility to adapt to the needs of the students this was instead more of a learn on yourown but with an impossible deadline there wasnt the time available to learn before we moved on to the next topic,"Veliz, Oscar"
17405,everything said above,"Mwaura, Jonathan"
17405,i really enjoyed having dr mwaura as a proffessor,"Mwaura, Jonathan"
17405,nothing more to add than what i have already said,"Mwaura, Jonathan"
17405,na,"Mwaura, Jonathan"
17405,1 i suggest clearer segregation of assignments on canvas particularly for students without zybooks access to avoid confusion2 more transparent grading criteria on gradescope would help students understand the rationale behind deducted points,"Mwaura, Jonathan"
17388,this is the first time i felt a course is a waste of my time and money i learned almost nothing from this professor or this course the professors interaction with students is minimal impacting the learningexperience and he makes everything very difficult for students ta office hour is not clear on teams regrading need to send a report that even takes more time than the homework itself the syllabusdoesnt match the course material too much to list please check all his wired setting for the class the course materials particularly the videos and slides are bad they primarily consist of reading offslides which is not effective for deep learning especially in an algorithm class where critical thinking and detailed explanations are crucial i am very disappointed,"Kennedy, Justin"
17388,online engagement through teams was decent,"Kennedy, Justin"
17388,1 make your own module videos2 provide actual feedback to students and answer their questions,"Kennedy, Justin"
17388,there is a lot of opportunity for the live professor to add value to the course,"Kennedy, Justin"
17388,the instructor did a good job on wellorganized teaching materials it would be better if more details about the application examples are given,"Kennedy, Justin"
17388,na,"Kennedy, Justin"
17388,i guess professor kennedys strength could show up once he found relaxed with small group of people without dumb questions there is no chances for him creating an inclusive learning at this scale he isnot capable of this but on small groups maybe there could be a chance,"Kennedy, Justin"
20450,the lecture is very clear,"Rad, Ryan"
20450,good,"Rad, Ryan"
35075,a true teacher,"Mwaura, Jonathan"
35075,the learning was inclusive prof did a great job including the students who phoned in each week this material is just hard,"Mwaura, Jonathan"
35075,give more practical questions like solving questions and then uploading source code for assignments there are only 10 of questions are leet code practical questions others are theory questions givefeedback for a final project proposal i never received feedback for my final project proposal even though i requested to review my project but the professor ignored my messages,"Mwaura, Jonathan"
35075,more focus on dynamic programming in class,"Mwaura, Jonathan"
31575,how is this class in the ai concentration for cs we did one ai homework and it wasnt even remotely challenging,"Amor-Tijani, Ghita"
31575,the instructor is very kind was fairly flexible with deadlines and clearly cares about student success and wellbeing,"Amor-Tijani, Ghita"
15376,prof sheshs ability to teach is his biggest skill which makes him an effective instructor the only area of improvement like mentioned earlier is more availability to his students i know he is the dean of cswhich could make this more challenging,"Shesh, Amit"
15376,get better tas who are able to grade more consistently,"Shesh, Amit"
15376,prof shesh knows how to capture students attention and is very eloquent i am impressed and admire his way of teaching his comments and answers are very interesting and can be interpreteddifferently depending on the student,"Shesh, Amit"
15376,the instructor is knowledgeable and has the teaching skills required however it could have been better if the instructor could actually cover the content required for the assignment before the deadline ofthe assignment,"Shesh, Amit"
40203,quizzes are given every week without any guidance on what they will be on not everyone learns well in this manner i for one struggle with quizzes as someone with attention issues it is hard for me to retaininformation unless i study specific points without knowing what to study i am at a huge disadvantage in this class,"Veliz, Oscar"
40203,quizzes dont need to be there for every class some classes dont cover a lot and quizzes are then on concepts either too trivial or not too much of,"Veliz, Oscar"
40203,no additional comments,"Veliz, Oscar"
40203,i personally does not like the chess assignment overall as an introduction to ai class the chess assignment does not seem to be intro level overall the beat random bot requirement needs lots of learningoutside class and does not seem to be related to the class topics i feel there is a gap between lectures and assignments,"Veliz, Oscar"
40203,professor oscar is very accommodating in facilitating inclusive learning,"Veliz, Oscar"
17367,the tas are not very responsible especially about their office hours they regularly dont show up on their office hours with or without prior notice furthermore there are too many office hours cancellationeven with the prior notification which frustrates students who need help for the class also some tas just easily say they dont know about the problem and ask us to ask other tas which is not veryprofessional as ta they must be more responsible and help their students especially when they encounter some problems they dont know they need to contact professor and get some solutions andcontact the student back not just saying they dont know other than some unprofessional tas this course was very well organized and helpful to learn web development,"Annunziato, Jose"
17367,make the homework more reasonable so we dont need to waste time on doing repeat work,"Annunziato, Jose"
17367,na,"Annunziato, Jose"
17367,what in tarnation is inclusive learning,"Annunziato, Jose"
17367,i greatly appreciated the detailed instructions for both labs and homework probably to make it more inclusive i would personally decreasecut the number of homework requirements,"Annunziato, Jose"
17367,a lot of tas dont show up on their working hours at all it should be regulated that if they dont come please send out a message beforehand on canvas stop wasting lots of students time by ghosting in theoffice hours,"Annunziato, Jose"
17367,strengthen the training of teaching assistants the points they give are unreasonable,"Annunziato, Jose"
17367,recommend some better projects for us to study,"Annunziato, Jose"
17367,all good,"Annunziato, Jose"
17367,great teaching,"Annunziato, Jose"
17367,the professor always listens to and incorporates our feedback into his teaching which is helpful this includes posting his code onto github so we can use it as a template and simplifying assignments to taketime to comprehend concepts also the class is structured in a way that you understand how the topics build off of each other and flow together,"Annunziato, Jose"
17367,i hope professor could give more guidance for deploy issue,"Annunziato, Jose"
17367,none,"Annunziato, Jose"
17367,good,"Annunziato, Jose"
17401, all positive for professor mwaura on inclusive learning,"Mwaura, Jonathan"
17401,professor mwaura really strives to include everyone id say its just an overall strength of his on the other hand sometimes wed stall class for a little to go over a topic if some folks didnt get it it would benice if some of that work could happen outside of class,"Mwaura, Jonathan"
17401,good,"Mwaura, Jonathan"
17401,was really good with this,"Mwaura, Jonathan"
17401,he is an enthusiastic instructor but sometimes he can stretch out a specific topic for too many classes,"Mwaura, Jonathan"
17401,the class itself was very enjoyable despite the difficulty of the material this is all thanks to dr mwaura,"Mwaura, Jonathan"
