crn,response,instructor
17401,i imagine its easier to get a good grade in this class than in other professors because its all openbook and basically untimed and the grade is more based on putting in the time than actually mastering thematerial but if you want to really learn from your professor instead of learning from books on the side dont take this class,"Mwaura, Jonathan"
17401,the professor always came very prepared for class sessions its very easy to feel the energy and passion he has and how much work he puts into preparing for lectures he knows how to slowdown whenstudents have hiccups with certain concepts and is always ready to give more elaborate explanations he is also readily available to chat after classes and during office hours about concerns anddifficulties,"Mwaura, Jonathan"
17401,i was satisfied with this course but i suggest that the workload of the class and the number of challenging problems might be reducedanother option could be to give challenging ungraded problems that we work through in the class for example you make as much progress on it as you can in the homework then review it in class that wasan approach that we took in some of my physics and math courses in college,"Mwaura, Jonathan"
13666,i think that adding in ways to force people to read the book would be good also to make it clear early on in the course that this course definitely has prerequisites in practice even if it doesnt in registration,"Tsekourakis, Iraklis"
13666,very knowledgeable and good at teaching however some of the complex concepts needs a little more explanation as sometimes hes a bit quick paced,"Tsekourakis, Iraklis"
13666,i think he is very good at giving more context to the things we learn on class like dfs and bfs applications on graphs and stuff i think it is more engaging when i know what i can do with what he teach i learneda lot from the class even though i might get a terrible grade but i learned,"Tsekourakis, Iraklis"
13666,integrate a richer variety of engaging teaching resources including animations illustrative images and videos to enhance the learning experience,"Tsekourakis, Iraklis"
13666,has clear concept and have the full understanding of the course materials he can understand what student wants to communicate easily keeps the class interactive so student doesnt feel a one waylearning,"Tsekourakis, Iraklis"
15377,he help to facilitate a better learning environment when he firmly ensured that we raised our hands when he asked questions in class during the first lectures tryhard students would shout out answersbefore anyone else had a chance to process the question or have the time to come up with an answer especially as a student without a cs background this was incredibly intimidating the professor didwell on shutting that down,"Behnezhad, Soheil"
15377,he records his classes and they are available all the time for us to revisit,"Behnezhad, Soheil"
15377,better explanation,"Behnezhad, Soheil"
15377,professor know well of the course material class is engaging and fun,"Behnezhad, Soheil"
15377,he and his teaching assistants will be very patient and helpful if you dont know how to do it please ask and let them know they will be very patient and enthusiastic to help you,"Behnezhad, Soheil"
15377,i think the instructor needs to provide better materials especially for exams he gave the practice for the final much sooner than the midterm so he does seem to listen to feedback,"Behnezhad, Soheil"
15377,v easy to understand his teaching v easy to approach him with doubts and questions,"Behnezhad, Soheil"
15377,i think soheil did a great job facilitating inclusive learning there are no suggestions i have for this aspect of his course,"Behnezhad, Soheil"
15377,teaching clearly is his biggest strength,"Behnezhad, Soheil"
15377,i had hard time trying to understand the concept of the topic most of the time,"Behnezhad, Soheil"
15377,i think the instructor made an effort to answer any questions the students had in class,"Behnezhad, Soheil"
15377,enthusiastic,"Behnezhad, Soheil"
15377,there seemed to be a difference in the expectation of answers for homework assignments this was evident when comparing the expectation that was set when assignment was released against thesolution key released after the deadlineif we can bridge the gap in terms of reducing the expectations on student answers to be at the level of the answer key that can save me some time being spent on assignments,"Behnezhad, Soheil"
15377,please make the teaching more better,"Behnezhad, Soheil"
15377,work on more problem solving sessions difficulty level of problems solved in class and given in exams was not the same,"Behnezhad, Soheil"
15377,i think prof behnezhad did a good job of explaining the material but i wish the pacing of the course was a little faster in the first half as it felt rushed to get in all the material as we approached the midtermwhich in term made it difficult to prepare,"Behnezhad, Soheil"
15377,be more prepared you were lost couple of times loved examples and level of questions please keep goingadd a project application is required to understand conecpt,"Behnezhad, Soheil"
15377,all good,"Behnezhad, Soheil"
15377,instructor is patient and helpful,"Behnezhad, Soheil"
15377,prof is really good a graphs and explaining the concepts,"Behnezhad, Soheil"
15377,i dont know about inclusive i guess just make sure that students who require more time on quizzes get the time allotted but other than that good stuff,"Behnezhad, Soheil"
15377,the instructor is absolutely fantastic,"Behnezhad, Soheil"
15377,hwk 2 was so close to the midterm and i didnt have enough time to revisit previous topics neither check if my answers were on the right track,"Behnezhad, Soheil"
15377,na see prior answers,"Behnezhad, Soheil"
15377,give more time on exams or change to online exam instead of writing code with hand,"Behnezhad, Soheil"
15377,he is a passionate instructor he can explain the material well and the test is well aligned with the class material,"Behnezhad, Soheil"
15377,is very good,"Behnezhad, Soheil"
15377,the lectures and notes are all really good whenever i needed to remember the specifics of a lecture i could always go back through the notes to write something down i had forgotten,"Behnezhad, Soheil"
15377,i think the coursework was really well organized and i felt that i was able to follow along pretty easily if there was something that i missed or if i couldnt make it to class i could easily figure out what to dothe assignments and tests were fair and grading was rather quick so you could get feedback quickly and figure out which areas to improvethe lectures sometimes felt a little disorganized andor the pace was too fast to follow along this could be because of how i prefer to learn but i think more examples of algorithms applied in real life andorpictorial demonstrations of how these algorithms would work andor just slowing down and really explaining each step and why we are doing them when introducing a new algorithm would be really helpful infollowing along,"Behnezhad, Soheil"
15377,soheil is a really nice guy and a good instructor i found him to be very passionate about the material and he was always very good about answering questions both in class and online,"Behnezhad, Soheil"
15377,he went through the algorithms but didnt formally prove them in class so it was tough to try to formally prove algorithms on the homework when we didnt get much instruction on how to make formalproofs,"Behnezhad, Soheil"
15377,the instructor has the clarity about the topics he covered in the class he explanation of difficult concepts are great signifying his good grasp on the course materials the instructor encouraged classroomdiscussions providing students a platform to think and come up with ideas to tackle problems at hand,"Behnezhad, Soheil"
15377,na,"Behnezhad, Soheil"
15377,takes students feedbacks and acts on it promptly,"Behnezhad, Soheil"
15377,na,"Behnezhad, Soheil"
15377,his patience kind friendly and solidness of knowledge i only hope that there could be a little more review sessions and code sessions,"Behnezhad, Soheil"
15377,if it is possible take some time after each class to discuss about materials,"Behnezhad, Soheil"
15377,i have no idea at the moment,"Behnezhad, Soheil"
15377,soheil is obviously very passionate about this subject and that is reflected in his teaching i got the feeling that he wasnt just reading us notes off slides but rather that he really wanted us to understand thetopics i think sometimes he would move a little quickly through things and students do not always feel comfortable asking questions in larger classes so sometimes they would fall behind but overall soheilwas a great professor,"Behnezhad, Soheil"
15377,the professor ensured clear and inclusive communication which enhanced the learning process,"Behnezhad, Soheil"
15377,professor soheil did great in this area i hope i can take his other classes before i graduate,"Behnezhad, Soheil"
15377,the course is very hard for an align student if the professor could provide more basic knowledge for them it would be excellent,"Behnezhad, Soheil"
15377,i think the teacher is very detailed and also gives bonus questions during the exam which i think are good considering the different basics of the students,"Behnezhad, Soheil"
15377,just make it harder,"Behnezhad, Soheil"
15377,the professor used only very outdated teaching policies and methods to teach the course which are known proven through many research studies and practice to be highly ineffective especially forrigorous mathematicallogical instruction the instructor was obviously unprepared for instruction in the method he chose which was also a poor outdated method he needs to read these researcharticles to learn how to teach and the effective methods for teaching as well as talk with the other instructors at khoury who already know these things and can help him understand i suggest removing himfrom the instruction of a required course and have him teach only electives while he builds his skills and preparedness for this course i would ask for my money back if i could for this poor quality ofinstructionthis course if taught this way should not be a mandatory class and should be an elective it lacked a focus on making the students better professionals which is an overall focus of the rest of the degree itwas misaligned with the degree objectives it verged on uninclusiveness with outdated policies and procedures which are harmful for neurodivergent identified or not people minorities and typicallyunderrepresented peoplethe professor made completing this trace evaluation part of timed quiz without telling us in advance that it was part of this particular quiz and it having other questions i was given less than 30 minutesto fill out this evaluation after answering the other technical questions of the quiz i typically spend at least an hour on trace evals so please keep in mind i have more to say and would have edited for clarityif i was allowed to complete this on my own time,"Behnezhad, Soheil"
15377,the homework is difficult and need extra self learning it can include more coding exercise and less algoritm proof,"Behnezhad, Soheil"
15377,na,"Behnezhad, Soheil"
15377,inclusiveness seemed fine,"Behnezhad, Soheil"
15377,i understand it is his first semester teaching so there are challenges that come with that and i can empathize with the difficulties of doing so however i am still paying a lot of money for a course and do notwant to be a guinea pig for a professor to sort things out i think the university should put more effort into monitoring and providing guidance and resources to new professors so it can be a positiveexperience for both the students and professor changes were made over the course of the semester which made the overall experience a bit better but it is incredibly frustrating when it took the first halfof the course to sort things out,"Behnezhad, Soheil"
21011,he is very nice and kind and he records every class so u can watch these records many times until u fully understand,"Penarrieta, Cristian"
35058,every one should take a class from prof aloupis hes an excellent teacher this was one of the hardest classes ive taken and im not going to get a great grade in it but it was definitely the most worthwhileive taken at northeastern i learned so much that will benefit me throughout my career and i will retain it because we were taught how to understand the material rather than just memorize it,"Aloupis, Gregory"
35058,great powerpoint summary and course notes,"Aloupis, Gregory"
35058,grading scale was confusing,"Aloupis, Gregory"
35058,all lectures should be recorded over a powerpoint like his new videos are done and he should replace the videos from many years ago exams should be much less unfairly challenging,"Aloupis, Gregory"
37459,im not really sure what this means in this context,"Venkatesaramani, Rajagopal"
37459,in class teaching and presentation,"Venkatesaramani, Rajagopal"
37459,professor take his class seriously wellprepared and answer students questions well,"Venkatesaramani, Rajagopal"
37459,he understand students and how to effectively communicate with them,"Venkatesaramani, Rajagopal"
37459,spend more time explaining difficult aspects in the course reduce random discussion time in class and focus the discussion within the incomprehensible knowledge aspects,"Venkatesaramani, Rajagopal"
37459,he was always willing to listen and talk to everyones ideas and was very inclusive to all answers,"Venkatesaramani, Rajagopal"
37459,i firmly believe that in two years taking this class with raj is going to be the best way to go its clear that hes newer to teaching this course and courses i general but he clearly cares a ton and is a goodlecturer so when it all comes together into a finished product it will be great its just a matter of when,"Venkatesaramani, Rajagopal"
37459,the instructors punctuality and organized course outline contributed positively to inclusivity however to enhance inclusivity further the instructor could incorporate more interactive elements toaccommodate diverse learning preferences and ensure all students feel engaged and valued in the learning process,"Venkatesaramani, Rajagopal"
37459,i think that the professor already does everything necessary regarding inclusive learning he is easily reachable online and he responds very quickly he is transparent about how and why he teaches theway he does and he readily answers questions and fosters an open environment in which to ask questions even just to repeat something he already said,"Venkatesaramani, Rajagopal"
37459,i really enjoyed how the professor made the class and the topics interesting and engaging always excited to learn new things this wayadd prerecord lecture sections that have examples available on canvas there are already youtube videos that explain similarly but it helps if professors can relate them to other topics from classadd calculations and formula work into slides rather than board similar yet different formulas writing them out seemed repetitive at times and confusing took a lot of class time,"Venkatesaramani, Rajagopal"
40214,great class with useful class content,"Sun, Zhifeng"
40214,improve recording,"Sun, Zhifeng"
40214,the instructor is doing fine for this class,"Sun, Zhifeng"
17364,could improve the autograder for assignment works so that students get right feedback and learning from assignments as well,"Mwaura, Jonathan"
17364,nothing yet,"Mwaura, Jonathan"
17364,the class environment felt extremely inclusive,"Mwaura, Jonathan"
17364,i felt at times in class i would ask a question and not really get an answer back that i was able to understand,"Mwaura, Jonathan"
17364,material,"Mwaura, Jonathan"
17600,this is my second course with professor hamandi her teaching is the best i have come across her lectures are structured very well she does in great job in ensuring that all students are following alongshe dissects complex topics and explains them very well to first time users i would 100 take all her courses if given the chance,"Hamandi, Lama"
17600,she is organized keeps the course engaging communicative friendly,"Hamandi, Lama"
17600,the workload is a little big,"Hamandi, Lama"
17600,very inclusive,"Hamandi, Lama"
17600,all good,"Hamandi, Lama"
17600,i felt comfortable in this class due to the small class size and ability to askanswer questions at any point i never felt like i could not ask a question regardless of how simple it was professor hamandi fostersa very inclusive learning environment and is always willing to take time to help us through questionsassignments,"Hamandi, Lama"
17371,the videos filmed in 2016 are outdated and hard to follow please re record those sections,"Aloupis, Gregory"
17371,speaking with the instructor felt fruitless at one point a student posted in our discussion board about adding 5 or 10 minutes to the exam length and the professor said no because it was his understandingthat those who did not perform well under that time limit did so because they didnt understand the topics and not because they didnt have enough time thats possible sure but when a b is given to astudent with a 40 in the class then i think something needs to be reworkedi really do like professor aloupis teaching style like i said above i would come away from each video feeling like i understood the material i have four separate notebooks full of notes from this course ispent hours on this material each week all to culminate in one of the worst averages ive ever had in a classmaybe im an outlier in this experience but i feel like im not considering the overall average of the class,"Aloupis, Gregory"
17371,no need for improvement,"Aloupis, Gregory"
17371,null,"Aloupis, Gregory"
17371,good material easy to followcoding would be more practical in this course,"Aloupis, Gregory"
17371,good,"Aloupis, Gregory"
40215,sometimes certain subjects are hard to understand so i think more examples are needed but they should be drawn in a clear and neat way and not all over the place it makes understanding for the firsttime a little easier when we can go back and look at the examples we did in class,"Lee, Hyonho"
40215,wv klervhoerivpoer,"Lee, Hyonho"
40215,the instructor knew the material well more time could have been spent teaching in lecture instead of reading off of lecture slides lecture slides can be read by students outside of class,"Lee, Hyonho"
40407,na,"Penarrieta, Cristian"
40407,the instructor delivers clear and helpful teaching material reflecting significant effort it helps in understanding complex concepts effectively,"Penarrieta, Cristian"
37894,i was able to answer all assignments using python rather than straight math as other algo teachers have required i am most comfortable demonstrating my knowledge and understanding of the material inpython rather than math proofs for me math proofs are akin to writing in a language i dont speak fluently i appreciate the ability to use the language and format that enables me to most accuratelyexpress my understanding of the material especially given that the course is a computer science course,"Kennedy, Justin"
37894,i dont think there is much to do,"Kennedy, Justin"
37894,online course is nice,"Kennedy, Justin"
35265,provide lectures for all topics with more understandable explanations,"Mwaura, Jonathan"
35265,the instructor is extremely knowledgeable and helpful and helped through all the queries and doubts i had during the course the instructor could focus more on covering different topics in the class whichwould provide a more understanding of the subject and also help in the assignments also for a topic questions similar to problem sets could be provided for personal practice of students so that they couldenhance their subject knowledge,"Mwaura, Jonathan"
35265,none,"Mwaura, Jonathan"
35265,na,"Mwaura, Jonathan"
35265,the workload is a little big for me,"Mwaura, Jonathan"
20301,i like how dr bhardwaj engages us actively in class discussions and activities to deepen our understanding of the concepts,"Bhardwaj, Anurag"
20301,pizza pizza pizza,"Bhardwaj, Anurag"
20301,teach harder,"Bhardwaj, Anurag"
20302,not good at explaining something complexmake complex things more complicatedstudents even feel less confident after taking this course,"Mukund, Smruthi"
20302,na,"Mukund, Smruthi"
20302,this course is really helpful for preparing for an sde interview professor mukunds insights and teachings have been particularly helpful i have gained a wealth of knowledge from the content she hasshared however the homework appears to extend beyond the class content presenting a challenge and we need a significant amount of time and effort to complete it if the professor could explain theassignments or possibly reduce the difficulty level it would greatly enhance the learning experience i really appreciate the professors guidance and believe that such adjustments would further contributeto the success of the course thank you,"Mukund, Smruthi"
20302,shes doing a pretty good job shes my favorite professor at northeastern so far i love that she uses inclass handwriting notes to teach not just slides moreover including examples during algointroduction from beginnerfriendly to more advanced the approach help me a lot,"Mukund, Smruthi"
20302,as mentioned above if her organizational skills could be improved especially regarding assignments and lectures this would be helpful,"Mukund, Smruthi"
40408,thank you so much for your instructions,"Rad, Ryan"
40408,the instructor has been hardworking in helping students get a strong grasp on the topic for both the common and advanced topics in the algorithm design and analysis field he knew when students couldhave difficulties preparing themselves before class during those topics and he had made videos to explain part of the topics in great details,"Rad, Ryan"
40408,the knowledge of real working experience the practical teaching style is really helpful,"Rad, Ryan"
40408,na,"Rad, Ryan"
40408,less homework more leetcode,"Rad, Ryan"
40408,idk just want to cheer him up,"Rad, Ryan"
40408,not required,"Rad, Ryan"
31430,the instructor is a really good teacher and empathizes  understands the situation of students but the course definitely needs to be restructured,"Amor-Tijani, Ghita"
31430,same as above,"Amor-Tijani, Ghita"
31430,the professor is very good at explaining concepts she makes you comfortable in the class and it helps while understand new concepts tas are helpful as well,"Amor-Tijani, Ghita"
31430,na,"Amor-Tijani, Ghita"
21186,his style of teaching is fresh and can pretty confidently answer most questions that arise but simultaneously acknowledges when he doesnt know something,"Venkatesaramani, Rajagopal"
21186,anyway the rajagopal is a good teacher trying to help students if he can improve the set of quiz and homework it will be better,"Venkatesaramani, Rajagopal"
21186,strengths the reading materials are a very good way of expanding my knowledgeareas of improvement people who have no idea of ai need to do a lot of postlecture studies to keep up this could be brought down to a minimum glace of the lecture notes basic revision one way that ibelieve would work is to plan the way to present the material,"Venkatesaramani, Rajagopal"
21186,i know for a fact that inclusiveness is one of his core teaching principles and i noticed that he strives for it i dont think its possible to facilitate a better learning environment,"Venkatesaramani, Rajagopal"
21186,1 very enthusiastic2 always willing to help3 showed a lot of demos and kept the class interesting4 the choice of topics were very interestingwhat can be improved is the clarity regarding what is expected from the assignment,"Venkatesaramani, Rajagopal"
21186, the professor is extremely enthusiastic and i have no doubt hell get better with time and in turn make the classes mor intuitive and interesting,"Venkatesaramani, Rajagopal"
21186,knowledgeablefriendlyinteractive,"Venkatesaramani, Rajagopal"
21186,instructor has good knowledge of the subject and is a good teacher who promotes interactions in class,"Venkatesaramani, Rajagopal"
21186,as mentioned above if professor took recitation sessions or something of that kind and gave exercises to practise it would be very useful for a student to become better in the course,"Venkatesaramani, Rajagopal"
21186,he was pretty good for someone who taught his first semester as an undergrad and grad professor he could work on making the class a little more interactive and maybe include labsrecitations from thenext semester onwards,"Venkatesaramani, Rajagopal"
21186,the instructor is very friendly open to answering questions and discussions they are very approachable and are very active on campuswire which is really helpful from an assignments point of viewthe instructor must provide more study material ensure tas adhere to their office hours timings and have more rigidity and structure in the overall course,"Venkatesaramani, Rajagopal"
21186,intuitive way of teaching very wellprepared slides with carefully pickedout examples,"Venkatesaramani, Rajagopal"
21186,i have autism and have a hard time learning and picking up content in a lot of my classes but he made the classroom and extremely inclusive environment for all you could ask questions any time and henever displayed any form of frustration or disapproval i cant give higher praise for a khoury processor at northeastern he definitely is one of the highlights of my college experience,"Venkatesaramani, Rajagopal"
21186, really enjoyed the teaching style and keeping the class interesting probably for the same one or two students asking redundant questions it could be helpful for all the other students to tell them to take the discussion after the class,"Venkatesaramani, Rajagopal"
